Identifiant,Nom,Description,Tag 1,Tag 2,Tag 3,Latitude,Longitude,N° et nom de rue,CP,Ville,Année de création,Url site web,Email,Nom compte Twitter,Url page Facebook,Url page Google +,Url page Linkedin,Url page Viadeo,Catégorie
/lab,/lab,Studio web de création/développement et de gestion de projet,,,,48.871403829000485,2.4563067380004213,55 rue Saint-Denis 93100 Montreuil,,,2010,http://slash-lab.fr/,jennifer@slash-lab.fr,SlashLabVox,https://www.facebook.com/SlashLabVox,https://plus.google.com/+SlashLabFr/,,,Entreprise
1000andone,1000Andone,"1000Andone développe Yesfuture, une application conversationnelle pour organiser des communautés, architecturer les échanges et faciliter les débats en ligne.",,,,48.893959,2.35278,110 rue des Poissonniers,75018,Paris,2010,http://www.yesfuture.net,,yesfuture,,,http://www.linkedin.com/company/1560836,,Entreprise
1001-menus,1001 Menus,1001 Menus propose une plate-forme web et mobile pour centraliser la communication digitale des restaurants.,,,,48.86813,2.34663,23 rue de Clery,75002,Paris,2010,http://www.1001menus.com,loic.hay@gmail.com,1001menus,,,http://www.linkedin.com/company/1161449,,Entreprise
123-venture,123 Venture,123Venture est une société de gestion indépendante avec plus de 800M€ investis dans le capital-investissement et l'immobilier.,,,,48.866089,2.28628,42 avenue Raymond Poincaré,75016,Paris,2000,http://www.123venture.com,,123Venture,,,http://www.linkedin.com/company/79342,http://fr.viadeo.com/fr/company/123venture,Investisseur
1913,1913,La société 1913 est spécialisée dans les besoins télécom et communications d'entreprise.,,,,48.831558,2.31361,141 rue Raymond Losserand,75014,Paris,2005,http://www.1913.fr,,,,,http://www.linkedin.com/company/530807,,Entreprise
1x1connect,1X1connect,"1x1 connect développe différents outils de marketing d’interaction web pour des sites média, e-commerce ou des marques.",,,,48.850102,2.35272,5 rue Cochin,75005,Paris,2010,http://www.1x1connect.com,,1x1connect,https://www.facebook.com/1x1connect,,http://www.linkedin.com/company/2909903,,Entreprise
292-contents,292 Contents,292 Contents est un producteurs de livres pour le troisième millénaire.,,,,48.84922,2.35151,22 rue de Pontoise,75005,Paris,2010,http://www.civilized.fr,,292Contents,,https://plus.google.com/102260489490743437407,http://www.linkedin.com/company/1467931,,Entreprise
360learning,360Learning,"360Learning est une solution web de e-learning pour créer rapidement des formations, les diffuser et suivre leur impact.",,,,48.8396,2.38872,203 rue de Charenton,75012,Paris,2009,http://www.360learning.com,,360learning,https://www.facebook.com/pages/360Learning-Le-Plaisir-de-Transmettre/148990175168498,,http://www.linkedin.com/company/360learning,,Entreprise
360°-capital-partners,360° Capital Partners,"360° Capital Partners regroupe des investisseurs dynamiques et agiles, profondément passionnés par la création de sociétés durables et offrant aux entrepreneurs un soutien de tous les instants.",,,,48.87104,2.34584,16 boulevard Poissonnière,75009,Paris,,http://www.360capitalpartners.com,,360CP,,,http://www.linkedin.com/company/360-capital-partners,,Investisseur
3w-academy,3W Academy,3W Academy propose une formation courte et intensive pour devenir développeur intégrateur web.,,,,48.85313,2.29113,17 rue Saint Saëns,75015,Paris,2012,http://www.3wa.fr,djamchid@3wa.fr,3WAcademy,https://www.facebook.com/3WAcademy,https://plus.google.com/101132748386194129526,http://www.linkedin.com/company/3146641,,École
42,42,"42 est une école gratuite, financée par la fondation Free, qui développe une méthodologie d'apprentissage par projet pour former de jeunes talents aux métiers informatiques et à la programmation.",,,,48.896229,2.3186,96 boulevard Bessières,75017,Paris,2013,http://www.42.fr,,42born2code,https://www.facebook.com/ecole42,https://plus.google.com/114371889748884562535,,,École
4n-media-group,4n Media Group,4n Media Group édite une solution mobile d’apprentissage des langues étrangères par l’actualité.,,,,48.854858,2.40352,80 rue des Haies,75020,Paris,2007,http://www.my4ntv.com,,4nmedia,,,http://www.linkedin.com/company/1919286,,Entreprise
50-partners,50 Partners,"Espace de Coworking : location de postes à conditions très flexibles et entrepreneuriales (www.leloft50partners.com) et Incubateur de Startups : mentoring par 50 entrepreneurs stars, bureaux, écosystème, financement (www.50partners.fr)",,,,48.86413999600046,2.3436700000004294,62 rue Jean-Jacques Rousseau,75001,Paris,2012,http://www.50partners.com,jmasurel@investirendirect.com,50partners,https://www.facebook.com/investirendirect,,,,Incubateur
50a,50A,"50A accompagne les grands comptes, les PME et les fédérations dans la conception et la mise en oeuvre de leur stratégie de communication digitale.",,,,48.871559,2.35025,32 rue de l'Echéquier,75010,Paris,,http://www.50a.fr,,agence50A,,,http://www.linkedin.com/company/1108309,,Prestataire
5e-rue,5e Rue,"5e Rue est un agenceur digital qui conseille et accompagne les entreprises et les institutions sur les enjeux d'image, de business et d'organisation soulevés par le web social.",,,,48.85672,2.37418,36 rue Sedaine,75011,Paris,2010,http://www.5erue.com,,5erue,http://www.facebook.com/5eRue,https://plus.google.com/106826478280245133986,,,Prestataire
5m-ventures,5M Ventures,"Fonds de ""Media for Equity"", 5M Ventures propose à des sociétés B2C en forte croissance de l'espace publicitaire dans des médias de premier plan en échange d'une ouverture de leur capital.",,,,48.869508,2.341908,28 place de la Bourse,75002,Paris,,http://www.5M-ventures.com,,,,,,,Investisseur
99metrics,99Metrics,"99Metrics aide les startups web à augmenter leurs revenus sur Internet en particulier sur l'acquisition d'audience, la conversion en client puis la rétention.",,,,48.87135,2.33764,13 rue de Marivaux,75009,Paris,2012,http://www.99metrics.fr,,99metrics,,,http://www.linkedin.com/company/3001973,,Prestataire
a-world-for-us,A World For Us,A World For Us est une équipe d'experts en logiciel et en applications web temps réel qui réalise des solutions interactives et sociales.,,,,48.829189,2.35124,17 rue des 5 Diamants,75013,Paris,2009,http://www.aworldforus.com,,aworldforus,,,http://www.linkedin.com/company/246655,,Entreprise
a2ia,A2iA,A2iA propose des logiciels toujours capables de répondre à toutes les problématiques de dématérialisation de documents.,,,,48.87655,2.31591,38 rue de la Bienfaisance,75008,Paris,,http://www.a2ia.com,,A2iA,,,http://www.linkedin.com/company/35653,,Entreprise
abilian,Abilian,"Editeur de logiciels open source qui propose des solutions innovantes pour votre entreprise ou votre organisation, dans les domaines de la collaboration émergente (entreprise 2.0), des processus métiers et de la gestion de l'information.",,,,48.8287300020005,2.3564900020004416,23 avenue d'Italie,75013,Paris,2012,http://www.abilian.com,sf@fermigier.com,abilianhq,https://www.facebook.com/abilian.corp,,http://www.linkedin.com/company/abilian/,,Entreprise
abstrakt,Abstrakt,Abstrakt est une agence digitale qui assure la promotion de marques et produits numériques en ligne.,,,,48.880669,2.36465,213 rue du Faubourg Saint Martin,75010,Paris,1998,http://www.abstrakt.fr,,abstraktnews,https://www.facebook.com/pages/abstrakt/102356576469615,,http://www.linkedin.com/company/688039,,Prestataire
académie-des-technologies,Académie des Technologies,L’Académie des Technologies a pour vocation d'émettre des propositions et des recommandations auprès des pouvoirs publics et des acteurs socio-économiques pour une meilleure exploitation des technologies au service de l'homme.,,,,48.864944,2.310285,Avenue Franklin D. Roosevelt,75008,Paris,2000,http://www.academie-technologies.fr,,,,https://plus.google.com/109615914757422944025,https://www.facebook.com/pages/Acad%C3%A9mie-des-technologies/122184864647451,,Acteur public
achat-centrale,Achat Centrale,Achat Centrale permet aux TPE et PME de faire des économies sur leurs achats en bénéficiant de conditions privilégiées sur leurs achats non stratégiques.,,,,48.88834,2.26215,3 boulevard de la Saussaye,92200,Neuilly-sur-Seine,2011,http://www.achatcentrale.fr,,AchatCentrale,https://www.facebook.com/achatcentrale.fr,,http://www.linkedin.com/company/achat-centrale,,Entreprise
actialuna,Actialuna,"Actialuna est une agence de design de livre numérique qui orchestre avec les éditeurs le travail des ingénieurs et des auteurs, en créant des interfaces innovantes et ergonomiques pour le livre.",,,,48.854858,2.40352,80 rue des Haies,75020,Paris,2009,http://www.actialuna.com,,Actialuna,,,http://www.linkedin.com/company/1574984,,Prestataire
activnetworks,ActivNetworks,"ActivNetworks est le créateur des solutions BoostEdge, des équipements réseau conçus pour accélérer les temps de réponse Web en réduisant et en optimisant les flux de données.",,,,48.689117,2.204451,1 rue de Terre Neuve,91940,Les Ulis,2004,http://www.activnetworks.com,,,,,http://www.linkedin.com/company/57663,,Entreprise
acute-games-boostr,Acute Games - Boostr,"Acute Games - Boostr produit Urban Rivals, jeu multi-joueurs gratuit avec plus de 800 personnages à découvrir, collectionner et faire évoluer pour combattre en direct des joueurs du monde entier.",,,,48.84034,2.39081,16 rue Dubrunfaut,75012,Paris,2005,http://www.urban-rivals.com,,urbanrivals,https://www.facebook.com/urbanrivals,,http://www.linkedin.com/company/1512985,,Entreprise
ad-invaders,AD-Invaders,AD-Invaders est à la fois une agence de conseil et un studio de jeux vidéo spécialiste du serious gaming.,,,,48.817982,2.33021,2 rue Danton,92120,Montrouge,,http://www.ad-invaders.com,,adinvaders,https://www.facebook.com/pages/AD-Invaders/177004672389057,,http://www.linkedin.com/company/393024,,Entreprise
adcuities,ADCUITIES,"ADCUITIES est une plateforme digitale dédiée au secteur de l'optique-lunetterie. Vous pouvez l'utiliser pour communiquer et engager le consommateur avec vos marques, générer du trafic en points de vente.",,,,48.8455361550005,2.350280163000434,71 bis rue du Cardinal Lemoine,75005 PARIS,,2012,http://www.opticshopping.com/,contact@adcuities.com,opticshopping,https://www.facebook.com/opticshopping,https://plus.google.com/105740358901889228675/posts,http://www.linkedin.com/company/adcuities?trk=top_nav_home,,Entreprise
addengo,Addengo,"Addengo est une solution de micro-paiement innovante qui a pour objectif de financer du contenu virtuel sur des sites éditeurs (Mobile & Web) grâce à de la publicité vidéo qualitative. Addengo, vous ne verrez plus la publicité comme avant !",,,,48.87261892829001,2.3356246948242188,5 rue Charles Fourier 91000 Evry,,,2013,http://www.addengo.fr/,contact@addengo.fr,Addengo,https://www.facebook.com/Addengo,,http://www.linkedin.com/company/3270909,http://www.viadeo.com/fr/company/addengo,Entreprise
adebe-networks,Adebe Networks,"Adebe networks développe des concepts de services d’accès à l’information via le web et le mobile et déploie son expertise dans de nombreux domaines : l’ergonomie, le design, le (e)marketing, le pricing, les business models et la valeur d’usage.",,,,48.849918,2.37272,16 rue Moreau,75012,Paris,2000,http://www.adebenetworks.com,,,,,,,Entreprise
adminext,Adminext,"Adminext est un cabinet de conseil spécialisé dans la réingénierie des processus publics, le pilotage stratégique des systèmes d’information et la mise en oeuvre de solutions innovantes de dématérialisation.",,,,48.83054,2.3292,48 avenue du Général Leclerc,75014,Paris,2007,http://www.adminext.com,,,,,http://www.linkedin.com/company/3036042,,Prestataire
advestigo,Advestigo,Advestigo propose une technologie d'empreintes numériques qui protège les contenus audio ou vidéo et permet leur distribution légale sur Internet.,,,,48.84193,2.22108,1 rue Royale,92210,Saint Cloud,,http://www.advestigo.com,,,,,http://www.linkedin.com/company/57701,,Entreprise
adways,Adways,Adways est spécialisée dans le rich média interactif et assure le développement de solutions et d’applications innovantes pour tous les supports en ayant recours à la vidéo enrichie.,,,,48.875179,2.32361,2 rue de la Pépinière,75008,Paris,2010,http://www.adways.com,,,https://www.facebook.com/adways.sas,,http://www.linkedin.com/company/2868632,,Entreprise
aerys,Aerys,"Aerys propose Minko, une technologie permettant de réaliser des applications 3D sur le web et sur mobiles, et Orbit, une technologie pour l’internet des objets.",,,,48.825661,2.3835,15 rue Jean-Baptiste Berlier,75013,Paris,2010,http://www.aerys.in,,AerysInnovation,https://www.facebook.com/aerysinnovation,,http://www.linkedin.com/company/1880115,,Entreprise
af83,af83,"af83 est une agence spécialisée en conception d’expérience, technologie et communication, qui accompagne ses clients dans la transformation de leur activité sur le digital pour offrir des services innovants à leurs utilisateurs.",,,,48.869228,2.3478,15 rue Poissonnière,75002,Paris,2006,http://www.af83.com,,af83,,,http://www.linkedin.com/company/af83,,Prestataire
afci-newsoft,AFCI Newsoft,"AFCI Newsoft est un centre de formation qui propose dans son catalogue de nombreuses formations diplômantes autour d'internet, du web et du multimédia.",,,,48.857582,2.437431,12 rue de Vincennes,93100,Montreuil,1989,http://www.afci.fr,,,https://www.facebook.com/afcinewsoft,,http://www.linkedin.com/company/2731633,,École
agence-française-informatique,Agence Française Informatique,L'AFI est une société de conseil spécialiste de l'informatique et des métiers des collectivités territoriales.,,,,48.9487,3.08767,4 rue de la Couture,77260,Sammeron,1981,http://www.afi-sa.fr,,,,,,,Prestataire
agence-propal,Agence Propal,"L'Agence Propal est une agence digitale spécialiste de Drupal qui offre développement, conseil et expertise.",,,,48.889542,2.34958,57 boulevard Barbès,75018,Paris,,http://www.propal.net,,,,,,,Prestataire
agilab,Agilab,"AgiLab offre une nouvelle génération d’applications web LIMS (Laboratory Information Management System) et ELN (Electronic Laboratory Notebook) pour la gestion de l’information dans les laboratoires de recherche, développement et contrôle qualité.",,,,48.871109,2.393599,24 rue de l'Est,75020,Paris,2010,http://www.agilab.fr,,,,,http://www.linkedin.com/company/agilab,,Entreprise
agora-plus,Agora plus,Agora Plus est un éditeur de logiciels qui propose des solutions full web aux collectivités locales.,,,,48.825661,2.3835,15 rue Jean-Baptiste Berlier,75013,Paris,2005,http://www.agoraplus.fr,,,,,,,Entreprise
agorabox,Agorabox,"Agorabox développe un logiciel libre permettant d'emmener partout son bureau numérique avec ses applications et ses fichiers, le tout sur une clé USB de 8GB.",,,,48.868664,2.3867,5 rue Eupatoria,75020,Paris,2008,http://www.agorabox.org,,agorabox,,,http://www.linkedin.com/company/agorabox,,Entreprise
agoralogie,Agoralogie,"Agoralogie est spécialisée dans la gestion de projets de travail collaboratif pour le web sémantique et l'étude des mesures de la qualité du travail, pour des résultats exploités scientifiquement.",,,,48.85141,2.37942,6  rue de Candie,75011,Paris,,http://www.agoralogie.fr,,Agoralogie,,,,,Entreprise
agoranov,Agoranov,"Agoranov est un incubateur public d'entreprises innovantes fondé par les Universités Pierre et Marie Curie et Dauphine, l’Ecole Normale Supérieure, ParisTech et l’INRIA.",,,,48.846191,2.32823,96 boulevard Raspail,75006,Paris,2000,http://www.agoranov.com,,,,,http://www.linkedin.com/company/87654,,Incubateur
agorize,Agorize,"Agorize, éditée par Studyka, est une plateforme SaaS dédiée à l’animation de communauté dans le but d’identifier les personnes les plus qualifiées et de les associer à la définition de la stratégie de l’organisation et à ses processus d’innovation.",,,,48.83078,2.3144,5 rue des Suisses,75014,Paris,2011,http://www.agorize.com,,,,,http://www.linkedin.com/company/1477703,,Entreprise
ahead-solutions,AHEAD SOLUTIONS,"Éditeur d'applications et solutions mobiles, agence de publicité sur mobile",,,,48.88452927745483,2.29489803314209,16 rue guillaume tell,,,2010,http://ahead-solutions.com/,admin@ahead-solutions.com,aheadsolutions,http://www.facebook.com/pages/Ahead-Solutions/186858731331648,https://plus.google.com/111989686610796349731,,,Entreprise
airbnb,Airbnb,Airbnb est une plateforme communautaire de location de logements entre particuliers.,,,,48.873089,2.3448,3 rue de Montyon,75009,Paris,2008,http://www.airbnb.fr,,airbnb_fr,https://www.facebook.com/AirbnbFrance,,http://www.linkedin.com/company/309694,,Entreprise
akamedia,Akamedia,Akamedia propose des services de production de contenus audiovisuels et des solutions de distribution pour tous les écrans.,,,,48.837639,2.2847,2 villa Thoréton,75015,Paris,2003,http://www.akamedia.net,,akamedia,https://www.facebook.com/pages/Akamedia/262525683655,,http://www.linkedin.com/company/akamedia,,Entreprise
akare,Akare,Akare est un éditeur de logiciels de gestion et d'applications collaboratives en ligne.,,,,48.870593,2.304993,66 avenue de Champs Elysées,75008,Paris,2007,http://www.akare.eu,,,,,http://www.linkedin.com/company/akare,,Entreprise
akka-venture,Akka Venture,"Levée de fonds, fusion acquisition",,,,48.87082300500049,2.3090715040004284,25,rue de ponthieu,75008 Paris,2006,http://www.akkaventure.com,dj@akkaventure.com,akkaventure,http://www.facebook.com/akkaventure,,,,Prestataire
alambik,Alambik,"Alambik est un incubateur qui regroupe une communauté de startups et un ""garage"" d'entrepreneurs de la génération Y.",,,,48.875641,2.34918,54 rue de Paradis,75010,Paris,,http://www.alambik.eu,,CuveeStartups,https://www.facebook.com/pages/Alambik/121092321281815,,,,Incubateur
alcatel-lucent,Alcatel-Lucent,"Alcatel-Lucent est un leader des technologies mobiles, fixes, IP et optiques, ainsi qu’un précurseur dans le domaine des applications et des services.",,,,48.662532,2.238112,7 route de Villejust,91620,Nozay,2006,http://www.alcatel-lucent.com,,AlcatelLucent,,,http://www.linkedin.com/company/1058,,Entreprise
aldebaran-robotics,Aldebaran Robotics,"Aldebaran Robotics est une société spécialisée dans la robotique. Elle a créé Nao, un robot humanoïde programmable.",,,,48.829922,2.31015,170 rue Raymond Losserand,75014,Paris,2005,http://www.aldebaran-robotics.com,,AldebaranR,,,http://www.linkedin.com/company/98040,,Entreprise
alenty,Alenty,"Alenty mesure si les publicités sur Internet sont vues. A l'aide d'une technologie embarquée avec les publicités, Alenty mesure plusieurs milliards de publicités par mois.",,,,48.87261892829001,2.3356246948242188,18 rue yves toudic 75010 Paris,,,2007,http://www.alenty.com,laurent.nicolas@alenty.com,alentycom,http://www.facebook.com/alenty,https://plus.google.com/113642299136780739556,http://www.linkedin.com/company/403554,,Entreprise
alert.us,Alert.Us,Alert.Us est une application mobile qui permet aux enfants d’obtenir l’aide de leurs proches dès qu’ils ont besoin d’assistance.,,,,48.8746,2.30392,7 avenue de Friedland,75008,Paris,2011,http://www.alert.us,,AlertUs,https://www.facebook.com/pages/AlertUs/191696730924046,,,,Entreprise
alfstore,Alfstore,Alfstore est un éditeur de solutions qui construit des applications sociales orientées métier pour Alfresco.,,,,48.825661,2.3835,15 rue Jean-Baptiste Berlier,75013,Paris,2010,http://www.alfstore.com,,Alfstore,,,http://www.linkedin.com/company/915876,,Entreprise
alice-innovation,Alice Innovation,Alice Innovation produit des solutions informatiques et des services technologiques dédiés au développement et au soutien de l'innovation.,,,,48.835155,2.536097,3 boulevard Georges Méliès,94350,Villiers sur Marne,,http://www.alice-innovation.com,,,,,,,Entreprise
alioscopy,Alioscopy,Alioscopy développe des solution et services 3D qui ne nécessitent pas le port de lunettes 3D pour être regardés.,,,,48.87094,2.394663,3 rue de l'Est,75020,Paris,1987,http://www.alioscopy.com,,Alioscopy,,,,,Entreprise
all-together,All Together,All Together est un réseau social de partage d'activités de loisirs en réel.,,,,48.89254,2.16894,17 rue Raymond Queneau,92500,Rueil-Malmaison,2012,http://www.all-together.net,,AllTogetherNet,http://facebook.com/AllTogether,https://plus.google.com/103028441603721567999,http://www.linkedin.com/company/all-together,,Entreprise
allmyapps,Allmyapps,Allmayapps développe un App Store pour Windows qui permet de découvrir et de gérer les applications sur PC.,,,,48.881618,2.31294,8 rue de la Terrasse,75017,Paris,2009,http://www.allmyapps.com,,allmyapps,https://www.facebook.com/allmyapps,,http://www.linkedin.com/company/allmyapps,,Entreprise
allocadeau,AlloCadeau,AlloCadeau est une conciergerie en ligne d'idées cadeaux.,,,,48.849209,2.37359,65 avenue Ledru-Rollin,75012,Paris,,http://www.allocadeau.com,,AlloCadeau,https://www.facebook.com/AlloCadeau,,,,Entreprise
alphacode,Alphacode,Alphacode propose des outils pour l'extraction d'information à partir de documents papier et offre des services pour la lecture et l'interprétation automatique des données.,,,,48.721779,2.0948,26 rue Mars,78110,Magny les Hameaux,,http://www.alphacode.eu,,,,,,,Entreprise
alphaui,AlphaUi,AlphaUi a lancé un prototype innovant pour donner efficacité et confort de saisie aux équipements de la mobilité sous la forme d'un clavier dorsal qui s’intègre aux smartphones et tablettes mobiles.,,,,48.893959,2.35278,110 rue des Poissonniers,75018,Paris,2008,http://www.alphaui.com,,AlphaUi_,,,,,Entreprise
altadyn,Altadyn,Altadyn propose des solutions web 3D pour créer des sites et organiser des événements collaboratifs synchrones.,,,,48.720039,2.279541,2 route de la Bonde,91300,Massy,2002,http://www.3Dxplorer.com,,Altadyn,http://www.facebook.com/pages/3DXplorer/183262528362198,,http://www.linkedin.com/company/altadyn,,Entreprise
alter-way,Alter Way,Alter Way est un opérateur de services open source dédié au Ddigital et au système d’information qui se démarque par son ADN 100 % opensource et sa démarche résolument devops et industrielle.,,,,48.84193,2.22108,1 rue Royale,92210,Saint cloud,,http://www.alterway.fr,,alterway,,,,,Entreprise
altic,Altic,"Altic est un intégrateur de solutions open source qui propose des ALTernatives pour votre système d'Information et de Communication en matière de business intelligence, de gestion de données et d'outils collaboratifs.",,,,48.872478,2.34463,25 rue Bergère,75009,Paris,2004,http://www.altic.org,,Altic_Buzz,,,http://www.linkedin.com/company/2059534,,Entreprise
alvarum,Alvarum,"Alvarum donne accès aux associations à des solutions clé en main, sans coût d’entrée, pour collecter des fonds et promouvoir leur cause.",,,,48.893959,2.35278,110 rue des Poissonniers,75018,Paris,2008,http://www.alvarum.fr,,Alvarumfr,https://www.facebook.com/alvarumfr,,http://www.linkedin.com/company/1686469,,Entreprise
alven-capital,Alven Capital,"Alven Capital est un fonds de venture capital indépendant qui investit principalement dans les secteurs d'internet, des médias et de l’IT.",,,,48.863708,2.33481,1 place André Malraux,75001,Paris,2000,http://www.alvencapital.com,,alvencap,,,http://www.linkedin.com/company/2177951,,Investisseur
amen,Amen,"Amen est fournisseur de noms de domaine, d'hébergement de serveurs et de plateformes eCommerce.",,,,48.869621,2.30977,12 rond point des Champs Elysées,75008,Paris,1999,http://www.amen.fr,,amenfrance,https://www.facebook.com/amensas,,http://www.linkedin.com/company/1173425,,Entreprise
ami-software,AMI Software,AMI Software est un éditeur de logiciels spécialisé dans les solutions de veille stratégique et d'intelligence économique.,,,,48.845879,2.37827,46 avenue Daumesnil,75012,Paris,,http://www.amisw.com,,ami_software,http://www.facebook.com/pages/AMI-Software/348124865173,,http://www.linkedin.com/company/139708,,Entreprise
anabole,Anabole,"Anabole est spécialisée dans la réalisation de produits numériques, l'édition et la recherche.",,,,48.885818,2.3232,23 rue Nollet,75017,Paris,1993,http://www.anabole.com,,,,,,,Entreprise
anakeen,Anakeen,"Experts en valorisation de l'information et haute technologie qui proposent Dynacase, une plateforme PHP pour développer et exécuter des applications web.",,,,48.85046,2.38612,33 rue de Montreuil,75011,Paris,1998,http://www.anakeen.com,,anakeen,,,http://www.linkedin.com/company/1200984,,Entreprise
anevia,Anevia,"Anevia propose des solutions IPTV and OTT (over-the-top) TV pour live et vidéos à la demande en streaming sur les écrans TV, ordinateurs, tablettes et mobiles.",,,,48.813969,2.34334,1 rue René Anjolvy,94250,Gentilly,2003,http://www.anevia.com,,aneviaiptv,,,http://www.linkedin.com/company/40174,,Entreprise
antenna,Antenna,Antenna créée des parcours de visite audio et multimedia pour aider les musées et les sites culturels à enrichir l'expérience de leurs visiteurs.,,,,48.85968,2.34602,3 rue des Déchargeurs,75001,Paris,1984,http://www.antennaaudio.com,,AntennaIntl,https://www.facebook.com/AntennaInternational,,http://www.linkedin.com/company/antenna-international,,Prestataire
anticafé,AntiCafé,"L'AntiCafé est un espace de coworking qui propose de payer au temps et de consommer à volonté : café, thé, snacks / wifi à très haut débit et matériels mutualisés.",,,,48.86227,2.3511,79 rue Quincampoix,75003,Paris,2013,http://www.anticafe.fr,info@anticafe.fr,,https://www.facebook.com/anticafe.eu,,,,Tiers-lieu
antvoice,AntVoice,AntVoice édite une solution innovante et puissante de recommandation sociale permettant aux sites marchands et medias de proposer les produits et les contenus pertinents pour chacun de leurs utilisateurs.,,,,48.86993,2.34624,28 rue du Sentier,75009,Paris,2009,http://www.antvoice.com,,antvoice,https://www.facebook.com/AntvoiceGroup,,http://www.linkedin.com/company/antvoice,,Prestataire
