Identifiant,Nom,Description,Tag 1,Tag 2,Tag 3,Latitude,Longitude,N° et nom de rue,CP,Ville,Année de création,Url site web,Email,Nom compte Twitter,Url page Facebook,Url page Google +,Url page Linkedin,Url page Viadeo,Catégorie
ooshot,Ooshot,"Ooshot.com est une plate-forme communautaire photographique de confiance basée à Paris. Elle permet de proposer sur son site des photographes de talent à travers le monde, de les découvrir et de les réserver.",,,,48.844122779000486,2.338093916000446,5 rue Auguste Comte,75006,Paris,2012,http://www.ooshot.com,Valerie@ooshot.com,ooshotParis,http://www.facebook.com/ooshot,,http://www.linkedin.com/company/ooshot,,Communauté
open-food-facts,Open Food Facts,"Open Food Facts est une communauté qui construit une base de données collaborative, libre et ouverte sur les produits alimentaires.",,,,48.8079,2.46498,21 rue des Iles,94100,Saint-Maur des Fossés,2012,http://www.openfoodfacts.org,,OpenFoodFactsFr,https://www.facebook.com/OpenFoodFacts.fr,,,,Communauté
open-initiative,Open Initiative,"Nous lançons Open Funding, une plate-forme de crowdfunding de logiciel libre qui permet aux utilisateurs de logiciels libres de financer l'évolution des logiciels, fonctionnalité par fonctionnalité",,,,48.879761,2.37198,29 rue de Meaux,75019,Paris,2010,http://www.openinitiative.com,,Open_Initiative,http://www.facebook.com/myopeninitiative,,,,Entreprise
opendatasoft,OpendataSoft,Opendatasoft propose une plateforme prête à l’emploi sur le cloud qui rend possible la réutilisation de toute donnée à partir de n’importe quels sources et formats et sans aucune limite de volumétrie.,,,,48.858551,2.3731,27 rue du Chemin Vert,75011,Paris,2011,http://www.opendatasoft.com,,opendatasoft,https://www.facebook.com/opendatasoft,,http://www.linkedin.com/company/2397209,,Entreprise
opensearchserver,OpenSearchServer,OpenSearchServer est un moteur de recherche opensource en mode SaaS.,,,,48.825661,2.3835,15 rue Jean-Baptiste Berlier,75013,Paris,2010,http://www.open-search-server.com,,,https://www.facebook.com/OpenSearchServer,,,,Entreprise
opteya,OPTEYA,"Optimisation pour le cloud, InfiniBand pour les masses. Développement d'applications innovantes autour d'InfiniBand. Linux, Linux et Linux. Logiciels Libres.",,,,48.86763193900049,2.3394015390004483,12 rue Vivienne,75002 Paris,,2010,http://opteya.com/,ydroneaud@opteya.com,,,,,,Entreprise
oracle,Oracle,"Oracle est une entreprise qui produit des logiciels tels que Oracle Database (un système de gestion de base de données), Oracle Weblogic Server (un serveur d'applications) et Oracle E-Business Suite (un progiciel de gestion intégré).",,,,48.909778,2.235132,15 boulevard Charles de Gaulle,92715,Colombes,1977,http://www.oracle.com,,oracle,https://www.facebook.com/Oracle,https://plus.google.com/+Oracle,http://www.linkedin.com/company/1028,,Entreprise
orange,Orange,Orange est l’un des principaux opérateurs de télécommunications dans le monde.,,,,48.825206,2.27607,38 rue du Général Leclerc,92130,Issy les Moulineaux,1988,http://www.orange.com,,orange,https://www.facebook.com/orange,https://plus.google.com/+orange/,http://www.linkedin.com/company/1110,,Entreprise
orbe,Orbe,"Orbe réunit des programmeurs, designers, artistes et scientifiques autour de l'expérimentation et la mise en œuvre de nouvelles expériences impliquant le corps et les nouveaux médias.",,,,48.865372,2.37073,70 rue de la Folie Méricourt,75011,Paris,2009,http://www.orbe.mobi,,OrbeMobi,https://www.facebook.com/pages/Orbe/134948119853640,,http://www.linkedin.com/company/460814,,Entreprise
orkos-capital,Orkos Capital,Orkos Capital est une société d'investissement indépendante spécialisée dans les technologies de l'information et de la communication.,,,,48.87619,2.3391,2 rue Fléchier,75009,Paris,2006,http://www.orkoscapital.com,,,,,http://www.linkedin.com/company/2066411,,Investisseur
osez-print,OSEZ PRINT,Service d'impression en ligne haut de Gamme. Impression Offset et Numérique & Rotativiste. Livraison Gratuite entre 3 et 10 jours ouvrés.,,,,48.870290151837814,2.3064208030700684,66 avenue des Champs Elysées,,,2009,http://www.osez-print.com,contact@osez-print.com,,,,,,Entreprise
ouishare,Ouishare,OuiShare est une communauté ouverte internationale composée de passionnés qui oeuvrent pour le développement de l’économie collaborative.,,,,48.879761,2.37198,29 rue de Meaux,75019,Paris,2012,http://www.ouishare.net,,OuiShare,https://www.facebook.com/OuiShare,,http://www.linkedin.com/company/2670616,,Communauté
oxala-consulting,Oxala consulting,Société de développement de solutions CRM et métiers innovantes en mode cloud avec Salesforce.com.,,,,48.835884201000454,2.383459139000422,26 rue paul belmondo 75012,,,2013,http://Www.oxalaconsulting.com,Olivier.spehner@oxalaconsulting.com,Oxala,,,,,Prestataire
oxiane-bretagne,OXiane Bretagne,Développement de sites web et d'applications mobiles. Conseil et formation autour des technologies associées. Expertise Javascript.,,,,47.201434607000465,-1.515944210999578,108 rue de la Libération,44230 Saint-Sébastien sur Loire,,2011,http://www.oxiane.com/bretagne/societe/,amustiere@oxiane.com,,,https://plus.google.com/u/0/b/102941536108345375790/,,,Prestataire
p.i.nk,P.I.Nk,P.I.Nk est une société d’investissement créée par faberNovel dont l’objectif est de répondre au manque de capital amorçage sur le marché européen en faveur des startups technologiques.,,,,48.868328,2.36601,17 rue du Faubourg du Temple,75010,Paris,2009,http://www.pinkbyfaber.com,,,,,,,Investisseur
pageondemand,PageOndemand,PageOndemand est solution en ligne de Catalogue Management pour les PME immédiatement rentable grâce au paiement à la page.,,,,48.865742,2.38441,120 boulevard de Ménilmontant,75020,Paris,2006,http://www.pageondemand.com,,PageOnDemand,https://www.facebook.com/PageOnDemand,,http://www.linkedin.com/company/669003,,Entreprise
pageyourself,PageYourself,PageYourself est un service en ligne d'édition et de personnalisation permettant la génération de sites professionnels sous Facebook.,,,,48.871109,2.393599,24 rue de l'Est,75020,Paris,2012,http://www.pageyourself.com,,PageYourself,https://www.facebook.com/pageyourself,,http://www.linkedin.com/company/2383823,,Entreprise
paliott,Paliott,"Paliott est une plate-forme de financement participatif dédié à la promotion et collecte de fonds au travers d'un article personnalisé pour les créateurs de projets, associations, auto-entrepreneurs ou autres.",,,,48.861379453000495,2.273272167000414,9 boulevard Jules Sandeau 75116 Paris,,,2013,http://www.paliott.com,elena.laurent@paliott.com,paliottweb,https://www.facebook.com/Paliott?ref=hl,,,,Entreprise
paraschool,Paraschool,Paraschool est une plateforme numérique de ressources éducatives à destination des enseignants et élèves.,,,,48.84885,2.35514,2 rue des Chantiers,75005,Paris,,http://www.paraschool.com,,Paraschool,,,http://www.linkedin.com/company/349870,,Entreprise
paris-angels-capital,Paris Angels Capital,Paris Angels Capital est une société d’investissement spécialisée dans l’accompagnement en capital de jeunes entreprises innovantes à fortes perspectives de croissance.,,,,48.863991,2.34968,16 rue de Turbigo,75002,Paris,2008,http://www.parisangelscapital.com,,,,,http://www.linkedin.com/company/605739,,Investisseur
paris-business-angels,Paris Business Angels,Paris Business Angels est une association qui réunit plus de 150 business angels de la région Parisienne et dont la vocation est de contribuer au développement de jeunes entreprises innovantes à fort potentiel de croissance.,,,,48.863991,2.34968,16 rue de Turbigo,75002,Paris,2004,http://www.parisbusinessangels.com,,Paris_BA,https://www.facebook.com/ParisBusinessAngels,,http://www.linkedin.com/profile/view?id=86591254,,Investisseur
paris-incubateurs,Paris Incubateurs,"Piloté par Paris Région Lab, Paris Incubateurs anime des programmes d'incubation thématiques et propose des lieux d'hébergement à destination des créateurs d’entreprises innovantes.",,,,48.871109,2.393599,24 rue de l'Est,75020,Paris,,http://www.parisincubateurs.com,,Paris_Incub,,,,,Incubateur
paris-innovation-belleville,Paris Innovation Belleville,Un des lieux d'hébergement proposé par Paris Incubateurs qui accueille en particulier les entreprises innovantes du programme d'incubation Creanova.,,,,48.871109,2.393599,24 rue de l'Est,75020,Paris,,http://www.parisincubateurs.com/sites_incubateur/get_site/25,,,,,,,Incubateur
paris-innovation-bourse,Paris Innovation Bourse,Un des lieux d'hébergement proposé par Paris Incubateurs qui accueille en particulier les entreprises innovantes du programme d'incubation lié au secteur de la finance.,,,,48.869508,2.341908,28 place de la Bourse,75002,Paris,,http://www.parisincubateurs.com/sites_incubateur/get_site/28,,,,,,,Incubateur
paris-innovation-masséna,Paris Innovation Masséna,Un des lieux d'hébergement proposé par Paris Incubateurs qui accueille en particulier les entreprises innovantes des programmes d'incubation technologies numériques et mobilité connectée.,,,,48.825661,2.3835,15 rue Jean-Baptiste Berlier,75013,Paris,,http://www.parisincubateurs.com/sites_incubateur/get_site/27,,,,,,,Incubateur
paris-innovation-réunion,Paris Innovation Réunion,Un des lieux d'hébergement proposé par Paris Incubateurs qui accueille en particulier les entreprises innovantes du programme d'incubation lié au secteur médiatique.,,,,48.854858,2.40352,80 rue des Haies,75020,Paris,,http://www.parisincubateurs.com/sites_incubateur/get_site/26,,,,,,,Incubateur
paris-pionnières,Paris Pionnières,"Paris Pionnières s'appuie sur une équipe de professionnels qui vous conseille, vous accompagne et vous propose des bureaux pour votre entreprise, de l’idée jusqu’à sa troisième année d’existence.",,,,48.858341,2.3725,26 rue du Chemin Vert,75011,Paris,2008,http://www.parispionnieres.org,,,https://www.facebook.com/pages/Les-Pionni%C3%A8res/157368310975832,,,,Incubateur
paris-région-innovation-nord-express,Paris Région Innovation Nord Express,"Un des lieux d'hébergement proposé par Paris Incubateurs qui accueille en particulier les entreprises innovantes des programmes d'incubation technologies numériques, nouveaux médias et jeux électroniques.",,,,48.893959,2.35278,110 rue des Poissonniers,75018,Paris,,http://www.parisincubateurs.com/sites_incubateur/get_site/30,,,,,,,Incubateur
paris-région-lab,Paris Région Lab,Le Laboratoire Paris Région Innovation créé à l'initiative de la Ville de Paris et de la Région Ile-de-France a pour but d'encourager le déploiement de solutions innovantes in vivo in situ sur le territoire francilien.,,,,48.871109,2.393599,24 rue de l'Est,75020,Paris,,http://www.parisregionlab.com,,innovcity,,,,,Acteur public
paristech-entrepreneurs,ParisTech Entrepreneurs,L'incubateur ParisTech Entrepreneurs est un organisme d'accompagnement qui soutient la création d'entreprises TIC innovantes.,,,,48.831581,2.33838,9 rue Dareau,75014,Paris,,http://entrepreneurs.telecom-paristech.fr,,IncubParisTech,https://www.facebook.com/pages/Incubateur-T%C3%A9l%C3%A9com-ParisTech-Eurecom-Entrepreneurs/421796347832607,,,,Incubateur
parrot,Parrot,Parrot est un fournisseur de périphériques sans fil pour téléphones mobiles.,,,,48.87896,2.36721,174 quai de Jemmapes,75010,Paris,1994,http://www.parrot.com,,ardrone,https://www.facebook.com/Parrot,,http://www.linkedin.com/company/13708,,Entreprise
partech-international,Partech International,Partech International est une société d'investissement en venture capital spécialisée dans les techologies de l'information et de la communication.,,,,48.872978,2.31639,12 rue de Penthièvre,75008,Paris,1982,http://www.partechventures.com,,partechventures,,,http://www.linkedin.com/company/563769,,Investisseur
pass-technologie,Pass Technologie,Pass Technologie est spécialiste du développement informatique particulièrement dans les logiciels libres.,,,,48.839722,2.40312,26 rue Louis Braille,75012,Paris,2002,http://www.pass-tech.fr,,,,,,,Entreprise
pasteke.com,Pasteke.com,Pasteke.com est une agence de communication globale.,,,,49.000622,1.6755,8 rue costes et bellonte,78200,Mantes la Jolie,2005,http://www.pasteke.com,,pasteke_,http://Www.facebook.com/pastekefan,https://plus.google.com/113645891726293520009,,,Prestataire
paypal,Paypal,"PayPal permet à une entreprise ou un utilisateur disposant d'une adresse email d'envoyer et de recevoir des paiements en ligne de manière pratique, sécurisée et peu coûteuse.",,,,48.86834,2.34116,21 rue de la Banque,75002,Paris,1998,http://www.paypal.com,,PayPal,https://www.facebook.com/PayPal,https://plus.google.com/+paypal,http://www.linkedin.com/company/1482,,Entreprise
payplug,PayPlug,"PayPlug propose une solution de paiement par carte bancaire, sans terminal, sur le web et le mobile.",,,,48.846191,2.32823,96 boulevard Raspail,75006,Paris,2012,http://www.payplug.fr,,payplug,https://www.facebook.com/PayPlug,,http://www.linkedin.com/company/2680294,,Entreprise
pearltrees,Pearltrees,"Pearltrees est une plate-forme de curation par centres d'intérêts qui permet de collectionner, d'organiser et de partager les contenus que vous aimez sur le web.",,,,48.851711,2.37636,94 avenue Ledru Rollin,75012,Paris,2009,http://www.pearltrees.com,,pearltrees,https://www.facebook.com/pearltrees,https://plus.google.com/+pearltrees,http://www.linkedin.com/company/1361436,,Entreprise
peego-start-up,Peego Start'Up,Peego Start'Up est l'incubateur de l'Université Paris Dauphine et est ouvert aux étudiants ou jeunes diplômés des établissements de Peego porteurs d'un projet.,,,,48.871288,2.27428,Place du Maréchal de Lattre de Tassigny,75116,Paris,,http://www.peego.dauphine.fr/index.php?id=8967,,,https://www.facebook.com/pages/PEEGO/197857936936906,,,,Incubateur
pepper-cube,Pepper Cube,"Pepper Cube est une agence de communication interactive qui propose ses services en matière de conseil éditorial et fonctionnel, de création graphique et de développement de sites internet et intranet aux entreprises et aux collectivités.",,,,48.85102066176807,2.4196958541870117,8-10 rue de Valmy,93100,Montreuil,2004,http://www.peppercube.net,jerome@peppercube.net,,,,,,Prestataire
pertimm,Pertimm,"Petrimm propose des solutions intégrées de moteurs de recherche linguistiques, sémantiques, et statistiques.",,,,48.914131,2.29484,51 boulevard Voltaire,92600,Asnières-sur-Seine,1997,http://www.pertimm.com,,,,,http://www.linkedin.com/company/131034,,Entreprise
pharmacloud,PharmaCloud,"PharmaCloud est une société de service du numérique,\\nspécialisée dans la création de sites marchand pour les pharmaciens. PharmaCloud accompagne les pharmaciens dans toutes les étapes et démarches pour s'ouvrir à la vente en ligne de médicaments.",,,,48.88946636000048,2.380801288000441,2,rue de Joinville,Paris,2013,http://www.pharma-cloud.fr,contact@pharma-cloud.fr,PharmaCloud1,https://www.facebook.com/pharmacloud.sarl,,http://www.linkedin.com/company/pharmacloud?trk=ppro_cprof,,Entreprise
pharmacloud-sarl,PharmaCloud SARL,PharmaCloud accompagne les pharmaciens qui veulent ouvrir leur e-pharmacie et se lancer dans la création du site internet de leur officine.,,,,48.88946757142427,2.380857467651367,2 rue de Joinville,75019,,2013,http://www.pharma-cloud.fr,contact@pharma-cloud.fr,,,,,,Entreprise
photonic-fablab,Photonic FabLab,"Au cœur du 503, Centre Entrepreneurial de l'Institut d'Optique Graduate School, le Photonic FabLab propose ses services aux porteurs de projets, qu'ils soient déjà chefs d'entreprise ou simplement étudiants",,,,48.7063408429962,2.1740055084228516,Rue du belvedère,bâtiment 503,campus scientifique,2012,http://www.institutoptique.fr/Entreprises/L-entrepreneuriat-a-l-Institut-d-Optique-Graduate-School/Le-Photonic-FabLab,camille.resseguier@institutoptique.fr,,,,,,Communauté
piedelephant.,PiedElephant.,"PiedElephant is a M&A and Fundraising Boutique dedicated to tech and creative companies. \\nBased in Paris, we work alongside entrepreneurs and startups across France, Europe and United States. \\nFor more details visit our website www.piedelephant.com",,,,48.863670189262386,2.3499155044555664,73 rue Saint-Denis,75001,Paris,2012,http://www.piedelephant.com,team@piedelephant.com,bb_piedelephant,https://www.facebook.com/PiedElephant,,http://www.linkedin.com/pub/barbara-belvisi/18/421/792,,Investisseur
pierlis,Pierlis,"Pierlis est une agence spécialisée dans le développement d'applications web, mobiles et de bureau et propose des solutions de plateformes e-commerce, de publication de contenu et de diffusion de vidéos.",,,,48.87083,2.34703,8 boulevard Poissonnière,75009,Paris,,http://www.pierlis.com,,,,,,,Prestataire
pikock,Pikock,Pikock propose une solution de création de site internet simplifiée dédiée aux particuliers et aux entrepreneurs entrepreneurs.,,,,48.87261892829001,2.3356246948242188,24 rue Chaptal,,,2012,http://www.pikock.com/,contact@pikock.com,Pikock_,https://www.facebook.com/Pikock,https://plus.google.com/b/114213989645672198357/114213989645672198357/posts,http://www.linkedin.com/company/pikock?trk=hb_tab_compy_id_2631992,http://www.viadeo.com/fr/company/pikock,Entreprise
pinpin-team,Pinpin Team,Pinpin Team est un studio de développement de jeux vidéos pour le mobile et le web.,,,,48.893959,2.35278,110 rue des Poissonniers,75018,Paris,2008,http://www.pinpinteam.com,,PinpinTeam,https://www.facebook.com/pinpinteam,,http://www.linkedin.com/company/1577834,,Entreprise
pix2know,Pix2know,"Réseau social autour de l'image. A partir d'une de tes photos, défies ta communauté ou tes amis.",,,,48.88621000000046,2.2873700020004435,8 avenue de la Porte de Champerret,75017,Paris,2013,http://www.pix2know.com,team@pix2know.com,pix2know,https://www.facebook.com/Pix2know,https://plus.google.com/117431581314291650499,http://www.linkedin.com/company/pix2know,,Entreprise
pixagility,Pixagility,Pixagility est spécialiste de la distribution de contenus vidéos sur tous types de plateformes et propose des solutions de stockage et de monétisation.,,,,48.833302,2.25387,64 avenue Pierre Grenier,92100,Boulogne Billancourt,,http://pixagility.tv,,,,,http://www.linkedin.com/company/738651,,Entreprise
pixcook,Pixcook,"Pixcook est un studio de création d'identité visuelle, d'ergonomie web et de jeux.",,,,48.892092,2.369204,134 rue d'Aubervilliers,75019,Paris,2011,http://www.pixcook.com,,pixcook,,,,,Entreprise
pixigeo,Pixigeo,Nous avons développé une application web qui permet de mettre en place toutes les modalités du travail collaboratif inter-entreprises.,,,,48.82779325400048,2.2436296800004243,117 ter rue du point du jour,92100,Boulogne-Billancourt,2013,http://www.pixigeo.com,bergiert@pixigeo.com,,,,,,Entreprise
placeloop,Placeloop,"Placeloop est une plateforme de marketing digital qui permet aux commerces de proximité de diffuser des messages et des coupons sur Internet, les réseaux sociaux, par email/SMS et des QR codes.",,,,48.854858,2.40352,80 rue des Haies,75020,Paris,2011,http://www.placeloop.com,,Placeloop,https://www.facebook.com/placeloop,,http://www.linkedin.com/company/2522187,,Entreprise
planzone,Planzone,"Planzone est un logiciel de gestion de projet collaboratif idéal pour les startups. Il offre des outils de planification de tâches, de partage de documents et discussions, et même de gestion de ressources, depuis une interface web simple à utiliser.",,,,48.814332909000484,2.350317103000407,43 Avenue Raspail,94250,Gentilly,2008,http://www.planzone.fr,clara.guenand@gmail.com,planzoneproject,,,http://www.linkedin.com/company/planzone,,Entreprise
playrion,Playrion,"Playrion est une société de développement et d'édition de jeux sérieux qui propose notamment Airlines-Manager, un jeu de gestion en ligne de compagnie aérienne.",,,,48.893959,2.35278,110 rue des Poissonniers,75018,Paris,2010,http://www.playrion.com,,Playrion,https://www.facebook.com/Playrion,,http://www.linkedin.com/company/2172017,,Entreprise
playsoft,PlaySoft,Playsoft est une agence de communication digitale spécialisée dans la création d'applications et de jeux vidéo mobiles.,,,,48.865629,2.392446,18 rue Soleillet,75020,Paris,2004,http://www.playsoft.fr,,PlaysoftCorp,https://www.facebook.com/pages/Playsoft/228311306331,,http://www.linkedin.com/company/playsoft,,Prestataire
playtouch,PlayTouch,"Playtouch développe et propose Jaxpot, un service de jeux en ligne pour gagner des cadeaux disponible pour tous les écrans.",,,,48.960663,1.803087,31 rue de la Vallée,78970,Mézières sur Seine,2010,http://www.playtouch.net,,,https://www.facebook.com/PLAYTOUCH.net,,http://www.linkedin.com/company/playtouch,,Entreprise
plyce,Plyce,"Plyce est une plateforme web et une application mobile géolocalisée qui vous permettent de trouver les bonnes affaires dans les points de vente : réductions, promotions et cadeaux.",,,,48.888076,2.306722,118 rue de Tocqueville,75017,Paris,2010,http://www.plyce.com,,plyce,https://www.facebook.com/plyce,,http://www.linkedin.com/company/1567274,,Entreprise
pléiade-venture,Pléiade Venture,Pléiade Venture est un investisseur engagé pratiquant l'investissement équitable aux côtés d'entrepreneurs innovants.,,,,48.873119,2.31596,29 rue de Miromesnil,75008,Paris,1999,http://www.pleiadeventure.com,,,,,http://www.linkedin.com/company/2445493,,Investisseur
polagram,Polagram,"Polagram est une application pour imprimer vos photos préférées - en 3 clics - à partir de votre iPhone, de votre iPad ou de votre Android.",,,,48.871364084000504,2.288619494000443,28 rue Paul Valery,75116,Paris,2012,http://www.polagr.am,jeremy@polagr.am,polagram,https://www.facebook.com/polagram,,,,Entreprise
pole-capital,Pole Capital,Pole Capital est une société d’investissement spécialisée dans la prise de participations à long-terme dans des entreprises non-cotées.,,,,48.859852,2.31766,41 rue Saint-Dominique,75007,Paris,2008,http://www.polecapital.com,,,,,http://www.linkedin.com/company/2216660,,Investisseur
popina,Popina,"Nous sommes l'éditeur de Popina, une caisse enregistreuse pour restaurant sur ipad. Nous avons l’idée que la technologie doit améliorer nos vies.  L’intuitivité des outils professionnels doit donc être au niveau de celle des produits grand-publics.",,,,48.82908825900046,2.3575743980004518,183 avenue de choisy,75013,,2013,http://www.popina.com,agent@popina.com,popinaTPV,https://www.facebook.com/popina.TPV,,,,Entreprise
postercloud,PosterCloud,"Pour planifier et réserver vos campagnes d'affichage publicitaire Offline, il y a désormais une solution Online…",,,,48.80423483864188,2.3344016075134273,44 rue Cauchy,94110,Arcueil,2012,http://www.postercloud.fr,jferuglio@postercloud.fr,postercloud,,,,,Entreprise
prepmyfuture,PrepMyFuture,PrepMyFuture développe une plateforme de e-learning adaptatif qui ajuste la difficulté des exercices en fonction de l'utilisateur et de ses faiblesses.,,,,48.872379,2.35754,82 rue du Faubourg Saint-Martin,75010,Paris,2010,http://www.prepmyfuture.com,,PrepMyFuture,https://www.facebook.com/PrepMyFuture,,http://www.linkedin.com/company/2372131,,Entreprise
press-criptum,Press'criptum,"Press'criptum développe Press Shopper, une application mobile permettant d'accéder aux informations de produits mode des magazines par reconnaissance d'image et de pouvoir les acheter directement.",,,,48.872421,2.32157,20 boulevard Malesherbes,75008,Paris,2011,http://www.presscriptum.com,,Presscriptum,https://www.facebook.com/Presscriptum,,http://www.linkedin.com/company/2631702,,Entreprise
presswall,PRESSWALL,"1ère agence photo BtoB, spécialisée dans la photo e-commerce (packshots, aplat, porté, piqué, 360, ghosts), Presswall et ses photographes sont présents à Paris et dans toute la France: reportages , portraits, animations photo et vidéo.",,,,48.87891651300049,2.295398065000427,9 rue bayen 75017 Paris,,,2009,http://www.presswall.fr,contact@presswall.fr,presswall,https://www.facebook.com/presswall,,,,Prestataire
pretty-simple,Pretty simple,Preety Simple développe des jeux sociaux pour Facebook.,,,,48.871109,2.393599,24 rue de l'Est,75020,Paris,2010,http://www.prettysimplegames.com,,prttysmpl,https://www.facebook.com/PrettySimpleGames,,http://www.linkedin.com/company/1119857,,Entreprise
priceminister,Priceminister,Priceminister est une plateforme de vente en ligne de produits neufs et occasions.,,,,48.866859,2.34968,92 rue Réaumur,75002,Paris,2000,http://www.priceminister.com,,priceminister,https://www.facebook.com/PriceMinister,https://plus.google.com/+priceminister,http://www.linkedin.com/company/28697,,Entreprise
printic,Printic,Printic est une application mobile pour le partage et l'impression de ses photos.,,,,48.84894,2.28689,45 rue Héricart,75015,Paris,2012,http://www.printicapp.com,,printicapp,https://www.facebook.com/Printic,,http://www.linkedin.com/company/3061865,,Entreprise
profileo,Profileo,Profileo est un agence de création de sites web spécialisée dans le e-commerce et le webmarketing avec une expertise Prestashop et Magento.,,,,48.84364,2.32258,3 rue de l'Arrivée,75014,Paris,2001,http://www.profileo.com,,Profileo,https://www.facebook.com/pages/Profileo/496374283729871,https://plus.google.com/106570232975916296219,,,Prestataire
promethean,Promethean,"Promethean propose des solutions innovantes pour l’éducation et la formation en fournissant des tableaux interactifs, logiciels, systèmes de réponses instantanées, périphériques, et matériels de sonorisation.",,,,48.903401,2.372051,45  avenue Victor Hugo,93300,Aubervilliers,2003,http://www.prometheanworld.com,,PrometheanFR,https://www.facebook.com/promethean.france,,,,Entreprise
