Identifiant,Nom,Description,Tag 1,Tag 2,Tag 3,Latitude,Longitude,N° et nom de rue,CP,Ville,Année de création,Url site web,Email,Nom compte Twitter,Url page Facebook,Url page Google +,Url page Linkedin,Url page Viadeo,Catégorie
items-international,ITEMS International,"ITEMS International est une société de conseil qui rassemble des associés et consultants de haut niveau dans les secteurs de l’internet, des télécoms, de la télévision et des systèmes d’information.",,,,48.86031,2.36797,70 rue Amelot,75011,Paris,1992,http://www.items.fr,,ITEMSint,https://www.facebook.com/ItemsInternational,,http://www.linkedin.com/company/items-international,,Prestataire
itop,iTOP,"A travers ses 3 filiales, iTOP est un groupe spécialisé dans l’intégration des nouvelles technologies de l’information et de la communication, associée à une vision innovante et pragmatique de sa mise en œuvre",,,,48.70948,2.17553,29 rue Jean Rostand,91400,Orsay,2003,http://www.itop.fr,,ITOPeducation,,,,,Entreprise
itslearning,Itslearning,Itslearning est l’un des acteurs clés du marché des environnements numériques de travail (ENT) opérant exclusivement dans le secteur de l’enseignement.,,,,48.872374,2.350023,13 rue d'Hauteville,75010,Paris,1999,http://www.itslearning.fr,,itslearning,https://www.facebook.com/pages/Itslearning-France/164514893584791,,,,Entreprise
izimobi,Izimobi,Izimobi est spécialisée dans le marketing direct sur téléphone mobile pour les points de vente.,,,,48.405788,2.70192,74 rue Grande,77300,Fontainebleau,2009,http://www.izimobi.fr,,izimobi,https://www.facebook.com/izimobi.france,,,,Prestataire
j-aime-attendre,J'aime Attendre,"J’aime Attendre recense les heures de grande affluence pour appeler ou se déplacer en heures creuses, c'est le bison futé des services clients et des files d'attente.",,,,48.867931,2.34469,120 rue Réaumur,75002,Paris,2009,http://www.jaimeattendre.com,,jaimeattendre,https://www.facebook.com/JaimeAttendre,https://plus.google.com/112068336254549474030,http://www.linkedin.com/company/1442019,,Entreprise
jalios,Jalios,"Jalios est un éditeur d'applications web spécialisé dans les solutions pour réseau social d’entreprise, espaces collaboratifs, portail personnalisé, gestion documentaire et gestion de contenus.",,,,48.827855,2.125485,58  rue Pottier,78150,Le Chesnay,2001,http://www.jalios.com,,Jalios,,,http://www.linkedin.com/company/92433,,Entreprise
jamespot,Jamespot,Jamespot édite une solution en mode SaaS de réseau social d'entreprise.,,,,48.85191,2.42149,27 rue du Progrès,93100,Montreuil,2005,http://www.jamespot.com,,jamespot,,,http://www.linkedin.com/company/224049,,Entreprise
jaïna-capital,Jaïna Capital,Jaïna Capital est un fonds d'investissement qui accompagne les nouveaux entrepreneurs talentueux dans la réussite de leur entreprise.,,,,48.865238,2.30959,1 rue François 1er,75008,Paris,2010,http://www.jaina.fr,,jainacapital,https://www.facebook.com/pages/Ja%C3%AFna-Capital/119217028094570,,http://www.linkedin.com/company/847524,,Investisseur
je-rêve-d-une-maison,Je Rêve d'une Maison,"Jerevedunemaison.com propose un concept novateur : vous accompagner dans la recherche, l'achat et l'usage à plusieurs de votre maison secondaire.",,,,48.881565769000474,2.322993631000429,40 rue de Moscou 75008 Paris,,,2013,http://www.jerevedunemaison.com/,sbuthaud@jerevedunemaison.com,revedunemaison,http://www.facebook.com/JeReveduneMaison,https://plus.google.com/102419670734535914766,http://www.linkedin.com/company/je-r-ve-d'une-maison,,Entreprise
jellynote,JellyNote,Jellynote est une plateforme communautaire pour la création musicale.,,,,48.869508,2.341908,28 place de la Bourse,75002,Paris,2012,http://www.jellynote.com,baptiste@jellynote.com,jellynote,https://www.facebook.com/JellyNote,,http://www.linkedin.com/company/2758702,,Entreprise
jiwok,Jiwok,Jiwok est une plateforme d'entraînements mp3 réalisés par des coachs et nutritionnistes professionnels.,,,,48.868462,2.36045,44 rue rené Boulanger,75010,Paris,2007,http://www.jiwok.com,,jiwok,,https://plus.google.com/105832920719073640933,http://www.linkedin.com/company/1801842,,Entreprise
jobaproximite,JOBaProximite,JOBaProximite est un site qui permet la mise en relation de personnes peu ou pas qualifiées avec de jeunes entreprises en recherche de collaborateurs sur un territoire géographique donné.,,,,48.876446,2.351271,82 rue d'Hauteville,75010,Paris,2012,http://www.jobaproximite.com,,,https://www.facebook.com/jobaproximite,https://plus.google.com/115713663659655403216,http://www.linkedin.com/company/2809520,,Entreprise
jobprod,JobProd,JobProd est un intermédiaire de recrutement qui fait se rencontrer des développeurs informatiques passionnés et des entreprises de qualité.,,,,48.822041,2.36082,19 rue Philibert Lucot,75013,Paris,2011,http://www.jobprod.com,,JobProdDev,https://www.facebook.com/jobprod,,http://www.linkedin.com/company/2354586,,Entreprise
john-s-graphisme,John's Graphisme,"Jonathan est directeur artistique web, son expertise va de la création de sites internet à l'application pour smartphone/tablette en passant par la vidéo. Il met son talent au service de différents clients, petites structures ou bien grands comptes.",,,,48.784600001000456,2.2379900040004372,71,route du pavé blanc,Clamart,2008,http://www.jonathan-menet.fr,jonathanmenet@gmail.com,johnsgraphisme,,,,,Prestataire
jolicloud,Jolicloud,Jolicloud est une application qui permet d'unifier et d'accéder à tous vos contenus stockés dans le cloud.,,,,48.86813,2.34663,23 rue de Cléry,75002,Paris,2009,http://www.jolicloud.com,,jolicloud,https://www.facebook.com/jolicloud,https://plus.google.com/+jolicloud,http://www.linkedin.com/company/709331,,Entreprise
jolicode,JoliCode,JoliCode est une agence experte dans la réalisation de projets web et mobiles de qualité.,,,,48.859589,2.37914,16 avenue Parmentier,75011,Paris,2012,http://www.jolicode.com,,JoliCode,https://www.facebook.com/JoliCode,https://plus.google.com/113059909911594633484,,,Prestataire
joue-avec,Joue Avec,"Editeur et créateur d'applications et solutions numériques : Responsive Design, TBI, Transmedia, Serious game, Html5, WebApp. Editeur de la collection Joue Avec l'art",,,,48.7207961040005,2.4929108140004246,30 rue du Mont Griffon,91330,Yerres,2013,http://www.joueavec.fr,contact@joueavec.fr,joueavec,,,,,Prestataire
journalism-plus-plus,Journalism++,Journalism++ est un réseau de journalistes de données qui développent des récits à partir de données.,,,,48.86462,2.35804,21 rue des Vertus,75003,Paris,2011,http://www.jplusplus.org,,jplusplus_,,,,,Prestataire
jouve,Jouve,"Le Groupe Jouve conçoit, enrichit, valorise et diffuse les contenus sur tous les médias et propose des services éditoriaux, dématérialisation, BPO, IT solutions et impression.",,,,48.858841,2.34839,11 boulevard de Sébastopol,75001,Paris,1903,http://www.jouve.fr,,GroupeJouve,,https://plus.google.com/103316327091227322721/,http://www.linkedin.com/company/groupe-jouve,,Entreprise
kadank,Kadank,"Kadank est un studio de création de jeux sociaux en 3D, multijoueurs et en temps réel.",,,,48.854252,2.3422,3 rue Séguier,75006,Paris,2011,http://www.kadank.com,,kadankgames,,,http://www.linkedin.com/company/2855204,,Entreprise
kalanit-creative-technologies,Kalanit Creative Technologies,"Fondée en Mai 2011, Kalanit Creative Technologies a pour objet la création d’applications mobiles à usage professionnel. \\nKalanit a développé l’appli iTakeNotes pour iPad. Cette application gratuite compte plus de 28 000 utilisateurs dans le monde.",,,,48.846372791000476,2.271452906000434,7 rue Narcisse Diaz 75016 Paris,,,2011,http://www.itakenotes.net,itakenotesforipad@gmail.com,itakenotesforipad,https://www.facebook.com/Itakenotes,,,,Entreprise
kawet,Kawet,Kawet est une application qui permet de créer un espace de travail mobile unifié pour votre entreprise.,,,,48.872379,2.35754,82 rue du Faubourg Saint-Martin,75010,Paris,2010,http://www.madebykawet.com,,madebykawet,https://www.facebook.com/madebykawet,,http://www.linkedin.com/company/865949,,Entreprise
kayentis,Kayentis,Kayentis est un éditeur de solutions professionnelles de dématérialisation de l’écriture manuscrite basées sur la plate-forme Digital Pen & Paper.,,,,48.701729,2.10113,4 route de la Noue,91190,Gif sur Yvette,2004,http://www.kayentis.com,,,,,http://www.linkedin.com/company/55808,,Entreprise
kelaïdo,Kelaïdo,"Kelaïdo lance Ciaofrom, une application mobile permettant à l'utilisateur de créer des photos immersives dans des sites historiques & touristiques.",,,,48.881959646000496,2.3237618200004135,17,Rue Clapeyron 75008 Paris,,2013,http://www.ciaofrom.com,jlbarthelemy@kelaïdo.com,,,,,,Entreprise
keres-technologies,Keres Technologies,"Keres Technologies apporte à l’industrie du multimedia, de la télévision et de la radio une expertise dans la maîtrise d’ouvrage de projets d'infrastructures de diffusion et de production.",,,,48.86372,2.808436,51 rue de l'Abyme,77700,Magny-le-Hongre,1999,http://www.keres-technologies.com,,,,,,,Entreprise
kernix,KerniX,"KerniX est une société spécialisée dans le développement d'applications web et mobile qui intervient notamment dans les domaines de l'e-commerce, de la gestion documentaire, et des plate-formes communautaires.",,,,48.836651,2.32423,15  rue Cels,75014,Paris,2001,http://www.kernix.com,,KerniX,,,http://www.linkedin.com/company/1281465,,Entreprise
kickyourapp,KickYourApp,KickYourApp est spécialisée dans le développement d’applications mobiles pour smartphones et tablettes à partir de son framework propriétaire.,,,,48.854858,2.40352,80 rue des Haies,75020,Paris,2006,http://www.kickyourapp.com,,kickyourapp,https://www.facebook.com/pages/Kick-Your-App/158519607511385,https://plus.google.com/116884231642610898788,http://www.linkedin.com/company/kickyourapp,,Entreprise
kima-ventures,Kima Ventures,Kima Ventures est un fonds d'investissement destiné à financer et à soutenir les entreprises internet et hightech les plus talentueuses.,,,,48.871311,2.32112,8 rue de la ville l'Evèque,75008,Paris,2010,http://www.kimaventures.com,,kimaventures,https://www.facebook.com/KimaVentures,,,,Investisseur
kiolis,Kiolis,Kiolis est une entreprise d’informatique spécialisée dans l’édition de logiciels de personnalisation : publication dynamique de contenus et moteurs de recommandation.,,,,48.835406,2.369898,45 boulevard Vincent Auriol,75013,Paris,2008,http://www.kiolis.com,,,,,http://www.linkedin.com/company/616768,,Entreprise
kisskissbankbank,KissKissBankBank,KissKissBankBank est une plate-forme de financement collaboratif de projets créatifs et innovants.,,,,48.874981,2.34965,1 cité Paradis,75010,Paris,2009,http://www.kisskissbankbank.com,,Kissbankers,http://www.facebook.com/kisskissbankbank,,http://www.linkedin.com/company/761641,,Entreprise
kit-digital,Kit Digital,Kit digital développe la télévision du futur en fournissant des solutions de diffusion numérique aux opérateurs.,,,,48.885529,2.31148,111 rue Cardinet,75017,Paris,2007,http://www.kitd.fr,,KITdigital,http://www.facebook.com/pages/KIT-digital-Inc/97814104509,,http://www.linkedin.com/company/kit-digital-inc,,Entreprise
knowledge-players,Knowledge Players,"Knowledge Players conçoit des solutions numériques d'apprentissage alliant le meilleur de la pédagogie, de l'écriture interactive et du jeu vidéo.",,,,48.84512,2.30209,44 rue Cambronne,75015,Paris,,http://www.knowledge-players.com,,KnowledgePlayer,https://www.facebook.com/pages/Knowledge-Players/200513629523,,http://www.linkedin.com/company/knowledge-players,,Entreprise
knowtex,Knowtex,"Knowtex est une communauté qui explore les transformations du XXIe siècle provoquées par la recherche scientifique, le design industriel et l’innovation technologique.",,,,48.86363,2.436492,104 avenue de la Résistance,93100,Montreuil,2010,http://www.knowtex.com,,Knowtex,https://www.facebook.com/knowtex,https://plus.google.com/114157731755244061915,http://www.linkedin.com/company/2891676,,Communauté
kobojo,Kobojo,Kobojo crée des jeux sociaux.,,,,48.853908,2.34037,23 rue des Grands Augustins,75006,Paris,2008,http://www.kobojo.com,,Kobojo,https://www.facebook.com/kobojo,,http://www.linkedin.com/company/685376,,Entreprise
kontest,Kontest,"Kontest est une plateforme pour créer et diffuser vos concours sur Facebook, le Web et les mobiles.",,,,48.865749,2.39198,14 rue Soleillet,75020,Paris,2010,http://www.kontestapp.com,,kontestapp,https://www.facebook.com/kontest,https://plus.google.com/111795208162182759084,http://www.linkedin.com/company/1257179,,Entreprise
krds,KRDS,KRDS est une agence de marketing digital spécialisée sur Facebook.,,,,48.866501,2.33489,2 rue des Moulins,75001,Paris,2008,http://www.krds.fr,,krds,https://www.facebook.com/KRDS,,http://www.linkedin.com/company/933279,,Entreprise
ktm-advance,KTM Advance,"KTM Advance propose des solutions de e-learning et serious gaming, à la croisée des sciences cognitives et des technologies du jeu vidéo.",,,,48.873871,2.34791,42 rue du Faubourg Poissonnière,75010,Paris,1995,http://www.ktm-advance.com,,KTMAdvance,https://www.facebook.com/KTMAdvance,,http://www.linkedin.com/company/489812,,Entreprise
kwaga,Kwaga,"Kwaga imagine des solutions pour que l’email soit plus simple, plus naturel, et moins envahissant et propose writethat.name un service de mise à jour automatique des contacts.",,,,48.825661,2.3835,15 rue Jean-Baptiste Berlier,75013,Paris,2009,http://www.kwaga.com,bein@kwaga.com,writethatname,http://www.facebook.com/pages/WriteThatName/183896871696601,https://plus.google.com/u/0/110561223415155311781/,http://www.linkedin.com/company/kwaga,,Entreprise
kxen,kXen,kXen fournit des solutions pour opérer des prédictions analytiques à partir des big data.,,,,48.870461,2.231742,25 quai Gallieni,92150,Suresnes,,http://www.kxen.com,,kxen,http://www.facebook.com/InfiniteInsight,,http://www.linkedin.com/company/kxen,,Entreprise
kylotonn,Kylotonn,Kylotonn est un studio de création de jeux vidéo qui développe ses propres solutions technologiques : moteur de rendu 3D avec Kt Engine et chaîne de production cross-plateformes avec Play All et Play Online.,,,,48.865629,2.392446,18 rue Soleillet,75020,Paris,2002,http://www.kylotonn.com,,,,,http://www.linkedin.com/company/52209,,Entreprise
l-accélérateur,L'Accélérateur,"Créé et animé par des serial entrepreneurs aguerris en prenant modèle sur le célèbre Y Combinator, l’Accélérateur a pour mission d’aider les startups à décoller.",,,,48.87135,2.33764,13 rue Marivaux,75002,Paris,2012,http://www.laccelerateur.fr,,laccelerateur,https://www.facebook.com/pages/LAcc%C3%A9l%C3%A9rateur/225490190871801,,,,Incubateur
l-appart-remix-coworking,L'Appart - Remix Coworking,"L'Appart est un espace de coworking unique, situé en plein coeur de Paris. Très chaleureux, cosy, c'est aussi un espace Remix, cela veut dire : pitchs, apéros, réseau, formations, et surprises. L'Appart est réservé aux créateurs et créatifs.",,,,48.87261892829001,2.3356246948242188,57,rue de turbigo,,2011,http://remixcoworking.com,contact@remixcoworking.com,Remixcoworking,https://www.facebook.com/RemixCoworking,,,,Tiers-lieu
l-appero,L'Appero,"L'Appero est une application mobile géolocalisée, propulsée par SmatPhood, qui permet de passer commande pour la livraison de produits à domicile.",,,,48.886822,2.32791,17 rue Ganneron,75018,Paris,2012,http://www.lappero.com,,lappero,https://www.facebook.com/lappero,,,,Entreprise
l-etablisienne,L'Etablisienne,"L'Etablisienne est un lieu dédié au faire-soi même, à l’ameublement et à l’habitat qui propose un atelier en self-service, des établis et des postes de travail à louer à l'heure ou à la journée.",,,,48.846062,2.40101,88 boulevard de Picpus,75012,Paris,2011,http://www.letablisienne.com,,L_Etablisienne,https://www.facebook.com/L.Etablisienne,,,,Tiers-lieu
l-ile-des-médias,L'Ile des Médias,L'Ile des Médias est une agence digitale interactive qui intègre une unité spécialisée sur les nouvelles technologies d'affichage interactif.,,,,48.867821,2.34089,15 rue de la Banque,75002,Paris,1996,http://www.ile-des-medias.com,,,,,http://www.linkedin.com/company/1892169,,Prestataire
la-banque-audiovisuelle,La Banque Audiovisuelle,"La Banque Audiovisuelle édite Vodeo, plateforme de vidéo à la demande dédiée aux documentaires et reportages.",,,,48.8754,2.35053,40 rue de Paradis,75010,Paris,2005,http://www.vodeo.tv,,vodeo,https://www.facebook.com/Vodeo,https://plus.google.com/+vodeo/,,,Entreprise
la-belle-assiette,La Belle Assiette,La Belle Assiette est une plateforme qui permet de réserver un chef professionnel pour qu'il vienne cuisiner à domicile.,,,,48.849998,2.2908,10 rue Béatrix Dussane,75015,Paris,2012,http://www.labelleassiette.fr,,LaBelleAssiette,https://www.facebook.com/labelleassiette,https://plus.google.com/101072660764734799950,http://www.linkedin.com/company/2673331,,Entreprise
la-boite-de-nuit,La Boite de nuit,"La Boite de Nuit lance « Des entrées pour des sorties » \\nUne box personnalisée sur le thème de la découverte artistique. \\nMusique, théâtre, expositions, festivals, cinéma… Découvrez et partagez. \\nVos invitations dans votre boîte aux lettres.",,,,48.87261892829001,2.3356246948242188,11 boulevard saint martin 75003,,,2013,http://laboitedenuit.fr,c.schilling@laboitedenuit.fr,,https://www.facebook.com/Laboitedenuit/info,,,,Entreprise
la-cantine,La Cantine,La Cantine est à la fois un lieu de travail et un projet collaboratif dédié aux nouvelles technologies qui propose aux acteurs de l’écosystème numérique un environnement propice à leur rencontre et leur collaboration.,,,,48.870468,2.3427,151 rue Montmartre,75002,Paris,2008,http://www.lacantine.org,,lacantine,https://www.facebook.com/LaCantineparSiliconSentier,,,,Tiers-lieu
la-fausse-boutique,La Fausse Boutique,"Concept-store qui ne vend que des produits venant à 100% de l'entreprenariat français. Son originalité réside dans le rassemblement en un même lieu d'un espace de vente, d'un atelier de création et d'un espace de coworking.",,,,48.882505306000496,2.333479847000433,32 rue Pierre Fontaine,75009,Paris,2012,http://www.lafausseboutique.com,vincent@lafausseboutique.com,fausseboutique,https://www.facebook.com/lafausseboutique,,,,Entreprise
la-fonderie,La Fonderie,La Fonderie - agence numérique d'Ile-de-France - est un organisme associé du conseil régional en charge du numérique qui pilote notamment le projet TechOnMap.,,,,48.83596,2.39575,39 rue de Wattignies,75012,Paris,2012,http://www.lafonderie-idf.fr,,lafonderie_idf,https://www.facebook.com/lafonderie.idf,https://plus.google.com/106271588359503534146,http://www.linkedin.com/company/2972733,,Acteur public
la-fonderie-de-l-image,La Fonderie de l'image,La Fonderie de l'image propose des formations aux métiers de la communication visuelle et du multimedia.,,,,48.861771,2.41651,80 rue Jules Ferry,93170,Bagnolet,1993,http://www.campusfonderiedelimage.org,,campuslfi,https://www.facebook.com/campusfonderiedelimage,https://plus.google.com/111115070638427793498,,,École
la-manufacture,La Manufacture,"Alternative au travail à domicile, au café ou en bibliothèque, La Manufacture est un espace de coworking qui propose des espaces de travail et de rencontres aux auteurs (scénaristes, écrivains, auteurs jeunesse, traducteurs, etc).",,,,48.847759,2.37702,100 rue de Charenton,75012,Paris,2010,http://la-manufacture.tumblr.com,,,https://www.facebook.com/pages/La-Manufacture/151257858237420,,,,Tiers-lieu
la-netscouade,La Netscouade,"La Netscouade est une agence digitale pionnière du web social, leader en innovation, communication d'influence, rich media et production web et mobile.",,,,48.84967,2.38001,8 passage Brûlon,75012,Paris,2007,http://www.lanetscouade.com,contact@lanetscouade.com,lanetscouade,https://www.facebook.com/lanetscouade,,http://www.linkedin.com/company/260333,,Prestataire
la-paillasse,La Paillasse,"La Paillasse est un biohackerspace, un laboratoire communautaire pour les biotechnologies citoyennes, qui est juxtaposé au hackerspace /tmp/lab",,,,48.775082,2.4093,6 rue Léon Geffroy,94400,Vitry sur Seine,,http://www.lapaillasse.org,,lapaillasse,,,,,Tiers-lieu
la-petite-etoile,La Petite Etoile,La Petite Etoile est le spécialiste du Business Plan et de la levée de fonds. Optez pour un Business Plan personnalisé ou bien pour l'un des outils BP de notre boutique en ligne !,,,,48.87261892829001,2.3356246948242188,10 rue du faubourg poissonnière 75010 Paris,,,2011,http://www.lebusinessplan.fr/,comesibieude@lebusinessplan.fr,lebusinessplan,https://www.facebook.com/lebusinessplan,https://plus.google.com/u/0/113054029288574118954/posts,,,Entreprise
la-poussinade,La Poussinade,La Poussinade est un espace de coworking qui héberge des startups et leur fournit un environnement de travail haut de gamme.,,,,48.872879,2.33944,10 rue Chauchat,75009,Paris,2012,http://www.la-poussinade.fr,,LaPoussinade,https://www.facebook.com/La.Poussinade,,,,Tiers-lieu
la-ruche,La Ruche,La Ruche est un espace collectif de travail et de création pour entreprendre autrement : il est ouvert à toute personne proposant une réponse innovante à un défi social ou écologique.,,,,48.872391,2.36488,84 quai de Jemappes,75010,Paris,2008,http://www.la-ruche.net,,HappyRuche,https://www.facebook.com/pages/La-Ruche-Paris/156399354385775,,,,Tiers-lieu
la-thé-box,La Thé Box,"La Thé Box envoie des coffrets de thé,infusions&gourmandises tous les mois sur le pas de votre porte pour vous faire découvrir une sélection pointue autour d'un thème.Voyagez sans bouger;des surprises poétiques et sensuelles pour rire et s’évader !",,,,48.87261892829001,2.3356246948242188,29 rue Dussoubs 75002 Paris,,,2013,http://www.lathebox.com,julia.ulman@lathebox.com,lathebox,https://www.facebook.com/laTheBox,,,,Entreprise
labo-de-l-edition,Labo de l'Edition,Un des lieux d'hébergement proposé par Paris Incubateurs qui accueille en particulier les entreprises innovantes du programme d'incubation lié aux mutations du secteur de l'édition.,,,,48.843559,2.35122,2 rue Saint Médard,75005,Paris,,http://www.parisincubateurs.com/sites_incubateur/get_site/29,,,,,,,Incubateur
labo-de-l-édition,Labo de l'édition,"Le Labo de l'Edition est un lieu consacré à la transition numérique et aux innovations dans toute le secteur de l'édition, tout à la fois incubateur, plateforme d'animation/rencontres et espace de coworking.",,,,48.843559,2.35122,2 rue Saint-Médard,75003,Paris,2011,http://www.labodeledition.com,,labodeledition,https://www.facebook.com/LabodelEdition,,,,Tiers-lieu
lacompany,Lacompany,"Conception, design et développement d'applications mobiles et web depuis 2008.",,,,48.81429000500049,2.3155200040004047,41 rue Perier,92120,Montrouge,2008,http://www.lacompany.fr,louis@lacompany.fr,lacompany,,,,,Prestataire
laptop,Laptop,"Laptop est un espace de coworking ouvert à tous concepteurs d'images, de textes, de sons, d'objets interactifs qui ont besoin de travailler de manière ponctuelle ou permanente dans un cadre calme, atypique et stimulant.",,,,48.87735,2.39068,6 rue Arthur Rozier,75019,Paris,2012,http://www.lelaptop.com,,Le_Laptop,https://www.facebook.com/LeLaptop,,,,Tiers-lieu
lawomatic,Lawomatic,Lawomatic propose un ensemble d’ateliers/bureaux à disposition des professions indépendantes créatives et innovantes.,,,,48.87413,2.37153,20 rue Jean Moinon,75010,Paris,2009,http://www.lawomatic.fr,,lawomatic,https://www.facebook.com/atelierlawomatic,,,,Tiers-lieu
lbmg-worklabs,LBMG Worklabs,"LBMG Worklabs, spécialiste du télétravail et du coworking, édite Néonomade un outil de recherche et de réservation d’espaces de travail pour les travailleurs nomades.",,,,48.893959,2.35278,110 rue des Poissonniers,75018,Paris,2010,http://www.neo-nomade.com,,neonomade_com,https://www.facebook.com/neonomadecom,https://plus.google.com/102549198905849304896,http://www.linkedin.com/company/923439,,Entreprise
le-camping,Le Camping,"Créé et animé par Silicon Sentier, Le Camping héberge des startups web et leur permet de prototyper leur projet, de se faire coacher par des mentors, et de fédérer des communautés d’utilisateurs pour valider leur produit.",,,,48.869508,2.341908,28 place de la Bourse,75002,Paris,,http://www.lecamping.org,,lecamping,https://www.facebook.com/pages/Le-Camping-Silicon-Sentier/128085203897792,https://plus.google.com/104324660391337746040/,,,Incubateur
le-grand-studio,Le Grand Studio,Le Grand Studio est une agence spécialisée dans les médias sociaux.,,,,48.828751,2.24049,1 place Paul Verlaine,92100,Boulogne Billancourt,2009,http://www.legrandstudio.com,,legrandstudio,https://www.facebook.com/legrandstudio,,,,Prestataire
le-hub-agence,Le Hub Agence,Le Hub est une agence digitale spécialisée dans la création et le mangement de systèmes d'information innovants et d'applications interactives.,,,,48.865459,2.3821,14 rue Crespin du Gast,75011,Paris,2007,http://www.lehub-agence.com,,lehub_agence,https://www.facebook.com/pages/Le-Hub-Agence/149700071759609,,,,Entreprise
le-loop,Le Loop,"Le Loop, Laboratoire Ouvert Ou Pas, est un hackerspace sans lieu fixe qui accueille barbus, curieux et projets créatifs.",,,,48.817696,2.332472,Avenue Lucien Descaves,75014,Paris,,http://www.leloop.org,,Le_Loop,,,,,Tiers-lieu
le-petit-ballon,Le Petit Ballon,"Le Petit Ballon ""Votre sommelier à la maison"" est le leader français du vin par abonnement : chaque mois découvrez 2 bouteilles de vin livrée à la maison, apprenez à les déguster en vidéo et bénéficiez des ventes privées pour les acheter à prix canon",,,,48.87780491500047,2.3204230040004177,43 rue du rocher,75008,,2011,http://www.lepetitballon.com,clement@lepetitballon.com,LPBallon,https://www.facebook.com/lepetitballon,,,,Entreprise
